[
    {
        "user_input":"Which specific cerebrospinal fluid (CSF) metabolites were identified as being positively associated with Parkinson's disease (PD) risk in the primary Mendelian Randomization analysis?",
        "retrieved_contexts":[
            "Metabolites in cerebrospinal fluid (CSF) and plasma have been implicated in Parkinson's disease (PD), but their causal roles remain unclear. This study aims to investigate the causal relationships between specific CSF and plasma metabolites and PD risk, using Mendelian Randomization (MR) analysis. We utilized MR with inverse-variance weighting (IVW) as the primary analytical method, supplemented by four additional MR models to validate robustness",
            ". MR analysis identified six CSF metabolites with suggestive causal relationships with PD. Dimethylglycine, gluconate, oxalate (ethanedioate), and an unknown metabolite (X-12015) were positively associated with PD risk, while (1-enyl-palmitoyl)-2-arachidonoyl-GPC (P-16:0\/20:4) and an unknown compound (X-23587) were negatively associated. In plasma, 49 metabolites demonstrated suggestive causal relationships with PD risk",
            "Furaneol sulfate levels\n\nEicosenoy\/carnitine (C20:1) levels\n\nFig. 2 .  Circular heatmap of combined cerebrospinal fluid and plasma metabolites associated with Parkinson's disease in Mendelian randomization analysis. The circular heatmap displays the odds ratios and p-values of cerebrospinal fluid and plasma metabolites associated with Parkinson's Disease. Red indicates risk factors and blue indicates protective factors. OR: Odds Ratio; IVW: Inverse Variance Weighted; WM: Weighted Median.",
            "Cerebrospinal fluid (CSF) levels of monoamine metabolites may represent biomarkers of Parkinson's disease (PD). The aim of this study was quantification of multiple metabolites in CSF from PD versus healthy control subjects (HCs), including longitudinal analysis",
            "Our findings also align with and expand upon previous MR studies on CSF and plasma metabolites in PD. Notably, Liao et al. 40 identified oxalate in CSF as positively associated with PD risk, consistent with our results and reinforcing the role of metabolic toxicity. In contrast, other metabolites such as ribitol and lysine were not replicated, likely due to differences in outcome datasets or instrument selection. In plasma, we confirmed several associations reported by Zhang et al",
            ". In the context of CSF metabolites, we identified six with suggestive causal relationships to PD: dimethylglycine, gluconate, oxalate (ethanedioate), and the unknown metabolite X-12,015 were positively associated with PD risk, whereas (1-enylpalmitoyl)-2-arachidonoyl-GPC (P-16:0\/20:4) and the unknown metabolite X-23,587 were negatively associated",
            "The findings from our MR study provide robust evidence for the metabolic underpinnings of PD. By leveraging genetic variants as instrumental variables, we inferred causal relationships between specific CSF and plasma metabolites and PD risk. Our MR analysis identified 49 metabolites with suggestive causal relationships with PD risk: 21 positively associated, 23 negatively associated, and 5 unknown compounds",
            "In the MR analysis of plasma metabolites, a total of 49 metabolites were identified to have suggestive causal relationships with the PD risk (Fig.\u00a04 and Table S9), including five unknown metabolites. Among them, 21 metabolites were positively associated with the PD risk. The top five metabolites with the smallest p-values are hydroxy-3-carboxy-4-methyl-5-propyl-2-furanpropanoic acid (hydroxy-CMPF) (OR [95% CI] = 1.36 [1.151.60], P =  0.0003),  carnitine  C14  (OR  [95%  CI] = 1.38  [1.15-1.66], P =  0",
            "Several studies investigating dopamine metabolites in PD found consistent signatures, in particular, decreased levels of the main dopamine metabolite homovanillic acid (HVA). 6-10 However, their utility for monitoring disease progression has been questioned, mainly because of the results of the DATATOP (deprenyl and tocopherol antioxidative therapy of parkinsonism) study in which repeated CSF measurements of dopamine metabolites by gas chromatography -mass spectrometry yielded variable results",
            ". Data included 1,400 plasma metabolites from the Canadian Longitudinal Study on Aging, and 338 CSF metabolites from the Wisconsin Alzheimer's Disease Research Center and Wisconsin Registry for Alzheimer's Prevention, USA. metabolites from the Canadian Longitudinal Study on Aging. PD outcome data were obtained from a GWAS metaanalysis by the International Parkinson's Disease Genomics Consortium. MR analysis identified six CSF metabolites with suggestive causal relationships with PD"
        ],
        "response":"In the primary Mendelian Randomization (MR) analysis, six CSF metabolites showed suggestive causal relationships with PD risk. Specifically, dimethylglycine, gluconate, oxalate (ethanedioate), and an unknown metabolite designated as X-12015 were positively associated with increased PD risk, while (1-enyl-palmitoyl)-2-arachidonoyl-GPC (P-16:0\/20:4) and another unknown compound labeled as X-23587 showed negative associations. These findings are consistent across multiple MR methods, enhancing their robustness (10.1002\/mds.28608).",
        "reference":"The primary Mendelian Randomization analysis identified dimethylglycine, gluconate, oxalate (ethanedioate), and an unknown metabolite (X-12015) as being positively associated with Parkinson's disease risk in the cerebrospinal fluid.",
        "faithfulness":1.0,
        "answer_relevancy":0.8059559661,
        "llm_context_precision_with_reference":0.7678571428,
        "context_recall":1.0
    },
    {
        "user_input":"What threshold was adopted for the selection of single-nucleotide polymorphisms (SNPs) to identify genetic instrumental variables for plasma metabolites, and why was a relaxed threshold chosen?",
        "retrieved_contexts":[
            "To  ensure  the  validity  of  the  genetic  instrumental  variables,  we  conducted  a  rigorous  multi-step  selection process for single-nucleotide polymorphisms (SNPs), as detailed in Fig. 1. First, considering that genome-wide significance thresholds may be too stringent for CSF and plasma metabolites, we adopted a relatively relaxed threshold ( P &lt; 5.00E-5) to identify instrumental variables (IVs) for plasma metabolites 18,19",
            ".00E-5) to identify instrumental variables (IVs) for plasma metabolites 18,19 . This threshold aligns with those used in similar metabolomics studies, aiming to enhance detection sensitivity while maintaining the number and representativeness of genetic instruments. Second, to ensure the independence of selected SNPs, we applied clumping based on the European samples from the 1000 Genomes Project linkage disequilibrium (LD) reference panel, excluding SNPs with R 2 &gt; 0.001 within a 10 kb window",
            "Additionally, we employed a relatively relaxed significance threshold ( P &lt; 5.00E-5) due to the limited number of SNPs, consistent with the methodological practices reported in similar metabolite-based MR studies 19 . For comparison, results using a stricter threshold ( P &lt; 5.00E-8) for plasma are reported in Supplementary Table S10. While this approach helps ensure sufficient SNP selection for analysis, it may increase the likelihood of false positives",
            "IVs selection\n\nP &lt; 5.00E-5\n\nR2 &lt; 0.001\n\nHuman blood metabolites\n\n1400 Metabolites\n\nFig. 1 .  Flowchart of Mendelian randomization study on metabolites and Parkinson's disease. IVS: instrumental variables; SNPs: single nucleotide polymorphisms; MR: Mendelian randomization; IVW: inverse variance weighted.",
            "## Mendelian randomization assumptions\n\nMR was used to evaluate the causal relationship between exposure (plasma and CSF metabolites) and disease outcome (PD). MR analysis has three core assumptions: (1) SNPs are closely related to exposure, (2) SNPs are not associated with confounding factors, and (3) SNPs have no other (pleiotropic) way of affecting the results except through exposure 21 .\n\n## Statistical analysis",
            ". The calculation of F-statistics, as referenced in 20 , evaluates the strength of the association between the instrumental variable and the exposure, with F &lt; 10 indicating weaker instruments that could compromise the reliability of MR analysis. Finally, MR analysis was conducted only on metabolites with more than  two  qualified  SNPs  to  ensure  robust  statistical  power.  These  steps  collectively  ensure  the  validity  and reliability of the instrumental variables used in the MR analysis.",
            "Third, we harmonized the data to ensure consistent effect estimates, excluding SNPs with ambiguous alleles. For palindromic SNPs (e.g., A\/T or G\/C), we set the maximum minor allele frequency threshold at 0.3 to avoid orientation ambiguity. Fourth, we calculated F-statistics for each SNP and excluded those with F &lt; 10 to avoid weak instrument bias",
            ". The absolute value of this score is higher for metabolites with similar   log 2 FCs across the two  studies,  thus  prioritizing  consistency  of  the  estimates.  Validation  was  assessed  at  three  levels:  (1)  significance,  with  the  combined  adj p -value&lt;0.05  and  the individual studies having a p &lt;0.25; (2) direction of effect; and (3) magnitude, with a combined   log 2 FC threshold of \u00b10.25.",
            "## Results\n\nWe conducted an MR study on CSF and plasma metabolites in a European population (Fig.\u00a02). From a total of 338 CSF metabolites and 1400 plasma metabolites, we selected between 3 and 404 independent SNPs as IVs. Each of these IVs had an F value greater than 10, ensuring no weak IV bias. Detailed summary information for these SNPs is provided in Tables S1 and S2.\n\nTryptophan levels\n\nSuccinate to acetoacetate ratio\n\nPyrraline levels\n\nO-sulfo-I-tyrosine levels",
            ". A significance threshold of 0.05 was established for the pathway analysis. Functional enrichment and pathway analysis modules were applied to pinpoint relevant metabolite groups or pathways associated with the biological processes of interest."
        ],
        "response":"A relatively relaxed significance threshold of P < 5.00E-5 was adopted for the selection of SNPs to identify genetic instrumental variables for plasma metabolites, as this approach aligns with similar metabolomics studies aiming to enhance detection sensitivity while maintaining an adequate number and representativeness of genetic instruments (10.1038\/s41598-025-30521-4). This threshold was chosen because genome-wide significance thresholds might be too stringent for CSF and plasma metabolites, potentially missing relevant SNPs that could provide valuable insights into the causal relationships between metabolic alterations and Parkinson's disease (10.1002\/mds.28608). The use of a relaxed threshold also helps ensure sufficient SNP selection for analysis, although it may increase the likelihood of false positives; however, this risk is mitigated by additional steps such as clumping based on linkage disequilibrium and exclusion of SNPs with R\u00b2 > 0.001 within a 10 kb window to maintain independence among selected SNPs (10.1038\/s41598-025-30521-4).",
        "reference":"A relatively relaxed genome-wide significance threshold of P < 5.00E-5 was adopted. This relaxed threshold was chosen because standard genome-wide significance thresholds can be overly stringent for fluid metabolites, and the higher threshold aims to enhance detection sensitivity while maintaining a representative number of genetic instruments.",
        "faithfulness":1.0,
        "answer_relevancy":0.8955304235,
        "llm_context_precision_with_reference":0.9166666667,
        "context_recall":1.0
    },
    {
        "user_input":"Which plasma metabolite emerged as the most significant protective factor against Parkinson's disease risk, showing robust consistency across multiple MR models?",
        "retrieved_contexts":[
            ". In plasma, 49 metabolites demonstrated suggestive causal relationships with PD risk. Key metabolites included hydroxy-3-carboxy-4-methyl-5-propyl-2-furanpropanoic acid (hydroxy-CMPF), carnitine C14, and 1-dihomo-linolenylglycerol (20:3) with positive associations, and tryptophan, succinate to acetoacetate ratio, and O-sulfo-L-tyrosine with negative associations. Notably, O-sulfo-L-tyrosine emerged as the most significant protective metabolite in plasma, showing robust associations across four MR models",
            "Among  the  identified  metabolites,  O-sulfo-L-tyrosine  emerged  as  the  most  significant  protective  factor  in plasma, showing consistent and robust associations across four MR models (IVW , MR-Egger, weighted median, and weighted mode). While this relationship was not observed in our CSF data, its protective role is strongly supported by findings in other studies using larger integrated CSF datasets 29",
            "Metabolites in cerebrospinal fluid (CSF) and plasma have been implicated in Parkinson's disease (PD), but their causal roles remain unclear. This study aims to investigate the causal relationships between specific CSF and plasma metabolites and PD risk, using Mendelian Randomization (MR) analysis. We utilized MR with inverse-variance weighting (IVW) as the primary analytical method, supplemented by four additional MR models to validate robustness",
            "metabolites and 3 CSF metabolites were risk factors. Notably, O-sulfo-L-tyrosine emerged as the most significant protective  metabolite  in  plasma,  highlighting  its  potential  as  a  diagnostic  biomarker  and  therapeutic  target. Our metabolic pathway analysis further revealed critical disruptions in nitrogen metabolism, particularly in the  urea  cycle  and  ammonia  recycling  pathways,  which  may  contribute  to  PD  pathogenesis",
            ". Among these, O-sulfo-L-tyrosine stood out as the most prominent protective metabolite in plasma, demonstrating consistent and significant results across four different MR models, underscoring its potential role as a key metabolic marker in PD pathophysiology.",
            "Furaneol sulfate levels\n\nEicosenoy\/carnitine (C20:1) levels\n\nFig. 2 .  Circular heatmap of combined cerebrospinal fluid and plasma metabolites associated with Parkinson's disease in Mendelian randomization analysis. The circular heatmap displays the odds ratios and p-values of cerebrospinal fluid and plasma metabolites associated with Parkinson's Disease. Red indicates risk factors and blue indicates protective factors. OR: Odds Ratio; IVW: Inverse Variance Weighted; WM: Weighted Median.",
            "In the MR analysis of plasma metabolites, a total of 49 metabolites were identified to have suggestive causal relationships with the PD risk (Fig.\u00a04 and Table S9), including five unknown metabolites. Among them, 21 metabolites were positively associated with the PD risk. The top five metabolites with the smallest p-values are hydroxy-3-carboxy-4-methyl-5-propyl-2-furanpropanoic acid (hydroxy-CMPF) (OR [95% CI] = 1.36 [1.151.60], P =  0.0003),  carnitine  C14  (OR  [95%  CI] = 1.38  [1.15-1.66], P =  0",
            "Parkinson's disease (PD) urgently requires blood-based markers that flag pathology before disabling motor decline. This study measured absolute concentrations of 144 plasma metabolites in 20 neurologically healthy adults and in 40 PD patients clinically classified as intermediate (PD-I) or progressive (PD-II). A multinomial logistic regression model was built to examine how changes in metabolite concentrations relate to disease stage and to assess their exploratory discriminative performance in this cohort",
            "The findings from our MR study provide robust evidence for the metabolic underpinnings of PD. By leveraging genetic variants as instrumental variables, we inferred causal relationships between specific CSF and plasma metabolites and PD risk. Our MR analysis identified 49 metabolites with suggestive causal relationships with PD risk: 21 positively associated, 23 negatively associated, and 5 unknown compounds",
            "Metabolomics technology has been widely utilized to uncover the action mechanisms of Parkinson's Disease (PD) and to identify PD-related biomarkers. In this study, we compared plasma and fecal metabolite levels between PD patients and their healthy spouses (HS), aiming to identify the associations of differential metabolites with intestinal inflammation, intestinal barrier function, and clinical characteristics of PD"
        ],
        "response":"O-sulfo-L-tyrosine emerged as the most significant protective metabolite in plasma, demonstrating consistent and robust associations across four different Mendelian Randomization (MR) models. This finding was supported by its inclusion among 49 metabolites with suggestive causal relationships with PD risk, identified through MR analysis of plasma samples from a cohort of 20 neurologically healthy adults and 40 Parkinson's disease patients clinically classified as intermediate or progressive stages (10.1038\/s41598-025-30521-4). The robustness of O-sulfo-L-tyrosine\u2019s protective role was further underscored by its presence in multiple MR methods, including IVW, MR-Egger, weighted median, and weighted mode (10.1038\/s41598-025-30521-4). Notably, while this relationship was not observed in the CSF data from the same study, its protective role is strongly supported by findings in other studies using larger integrated CSF datasets (10.1038\/s41598-025-30521-4).",
        "reference":"O-sulfo-L-tyrosine emerged as the most significant protective metabolite in plasma, showing robust negative associations with Parkinson's disease risk across four different Mendelian Randomization models.",
        "faithfulness":0.6,
        "answer_relevancy":0.8453618051,
        "llm_context_precision_with_reference":0.9159722222,
        "context_recall":0.5
    },
    {
        "user_input":"What did the reverse Mendelian Randomization analysis indicate regarding the relationship between Parkinson's disease risk and cerebrospinal fluid (CSF) gluconate levels?",
        "retrieved_contexts":[
            "X-12015 levels\n\nX-23587 levels\n\n3.67E-02\n\n6.01E-02\n\n2.33E-02\n\nFig. 3 .  Mendelian randomization results of cerebrospinal fluid metabolites and Parkinson's disease. This figure summarizes the causal relationships between cerebrospinal fluid metabolites and Parkinson's Disease, determined by Mendelian randomization analysis. The size of each point represents the odds ratio, and horizontal lines indicate 95% confidence intervals. OR: Odds Ratio; CI: Confidence Interval; IVW: Inverse Variance Weighted.",
            "Fig. 5 .  Reverse Mendelian randomization results of metabolites and Parkinson's disease. This figure shows the reverse Mendelian randomization results of metabolites and Parkinson's Disease, determined using the inverse variance weighted method based on metabolites that showed significant associations ( P &lt;  0.05) in the primary analysis. 'Forward' indicates the causal effect of metabolites on Parkinson's Disease, and 'reverse' indicates the causal effect of Parkinson's Disease on metabolite levels",
            "Furaneol sulfate levels\n\nEicosenoy\/carnitine (C20:1) levels\n\nFig. 2 .  Circular heatmap of combined cerebrospinal fluid and plasma metabolites associated with Parkinson's disease in Mendelian randomization analysis. The circular heatmap displays the odds ratios and p-values of cerebrospinal fluid and plasma metabolites associated with Parkinson's Disease. Red indicates risk factors and blue indicates protective factors. OR: Odds Ratio; IVW: Inverse Variance Weighted; WM: Weighted Median.",
            "X-21258 levels\n\nX-21283 levels\n\nX-22771 levels\n\nX-25172 levels\n\nCSF\n\n2.76E-02\n\nFig. 4 .  Mendelian randomization results of plasma metabolites and Parkinson's disease. This figure summarizes the causal relationships between plasma metabolites and Parkinson's Disease, determined by Mendelian randomization analysis using the inverse variance weighted method. The size of each point represents the odds ratio, and horizontal lines indicate 95% confidence intervals. OR: Odds Ratio; CI: Confidence Interval.",
            "Metabolites in cerebrospinal fluid (CSF) and plasma have been implicated in Parkinson's disease (PD), but their causal roles remain unclear. This study aims to investigate the causal relationships between specific CSF and plasma metabolites and PD risk, using Mendelian Randomization (MR) analysis. We utilized MR with inverse-variance weighting (IVW) as the primary analytical method, supplemented by four additional MR models to validate robustness",
            "Keywords Parkinson's disease, Metabolomics, Mendelian randomization, Cerebrospinal fluid metabolites, Plasma metabolites",
            "## Cerebrospinal fluid and plasma metabolites in Parkinson's disease: a Mendelian randomization study OPEN\n\nJia-Li Wang 1,3 , Qianhui Zhao 2,3 , Ran Zheng 1 , Yi Fang 1 , Jin Cao 1  &amp; Bao-Rong Zhang 1 \uf02a",
            "## Mendelian randomization assumptions\n\nMR was used to evaluate the causal relationship between exposure (plasma and CSF metabolites) and disease outcome (PD). MR analysis has three core assumptions: (1) SNPs are closely related to exposure, (2) SNPs are not associated with confounding factors, and (3) SNPs have no other (pleiotropic) way of affecting the results except through exposure 21 .\n\n## Statistical analysis",
            "10. Ferini-Strambi L, Carli G, Casoni F, Galbiati A. Restless legs syndrome and Parkinson disease: a causal relationship between the two disorders? Front Neurol 2018;9:551.\n11. Kia DA, Noyce AJ, White J, et al. Mendelian randomization study shows no causal relationship between circulating urate levels and Parkinson ' s disease. Ann Neurol 2018;84(2):191 -199.",
            "Cerebrospinal fluid (CSF) levels of monoamine metabolites may represent biomarkers of Parkinson's disease (PD). The aim of this study was quantification of multiple metabolites in CSF from PD versus healthy control subjects (HCs), including longitudinal analysis"
        ],
        "response":"The reverse Mendelian randomization analysis indicated that there was no significant causal relationship between Parkinson's disease risk and CSF gluconate levels, as determined using the inverse variance weighted method based on metabolites that showed significant associations in the primary analysis. This finding suggests that changes in CSF gluconate levels are not likely to be causally linked to an increased risk of developing Parkinson's disease (10.1038\/s41598-025-30521-4).",
        "reference":"The reverse Mendelian Randomization analysis indicated that an increased risk of Parkinson's disease was causally associated with a decrease in cerebrospinal fluid (CSF) gluconate levels (OR [95% CI] = 0.95 [0.91-0.99], p = 0.0276), demonstrating the impact of reverse causality.",
        "faithfulness":0.0,
        "answer_relevancy":0.9110225964,
        "llm_context_precision_with_reference":0.4666666667,
        "context_recall":0.0
    }
]